{
  "schema_version": 13,
  "report": "pack-status",
  "entries": [
    {
      "pack": "example-pack",
      "pack_version": "3.0.0",
      "surface": "claude",
      "intent": {
        "state": "known",
        "active": true,
        "revision": 1,
        "version": "3.0.0",
        "selection": {
          "mode": "custom",
          "roots": [
            {
              "kind": "skill",
              "id": "ask-matt"
            }
          ]
        },
        "resources": [
          {
            "kind": "skill",
            "id": "ask-matt"
          }
        ]
      },
      "update_available": false,
      "projection_summary": {
        "verified": 1,
        "missing": 0,
        "drifted": 0,
        "ambiguous": 0,
        "unmanaged": 0
      },
      "projection_details": [
        {
          "id": "skill:example",
          "target": "$HOME/.claude/skills/example",
          "owner": "example-pack",
          "health": "verified",
          "observed_fingerprint": "sha256:example",
          "desired_fingerprint": "sha256:example"
        }
      ],
      "contract": {
        "compatibility": "complete",
        "logical_resource_counts": {
          "Skills": 1,
          "Instructions": 0,
          "Agents": 0,
          "Assets": 0,
          "Notices": 0
        },
        "dependency_closure": [],
        "bindings": [],
        "exclusions": [],
        "optional_modes": [],
        "prompt_authorities": [],
        "aliases": [],
        "authority_disclosure": "Activation grants only sealed actions.",
        "resource_graph": {
          "resources": []
        },
        "selection_validity": {
          "all": {
            "available": true,
            "reasons": [],
            "optional_exclusions": []
          },
          "roots": []
        },
        "resource_definitions": []
      },
      "readiness": {
        "configured": "true",
        "authorized": "unknown",
        "usable": "unknown"
      },
      "blockers": [],
      "evidence": [
        "static projection inspected"
      ],
      "pending_human_actions": [
        "supply explicit runtime loading evidence"
      ],
      "optional_authorities": [
        {
          "mode_id": "browser-network",
          "authority": "browser",
          "state": "unknown",
          "fallback": "static evidence-only analysis"
        },
        {
          "mode_id": "browser-network",
          "authority": "network",
          "state": "available",
          "fallback": "static evidence-only analysis"
        }
      ],
      "resource_selections": [
        {
          "resource": {
            "kind": "skill",
            "id": "ask-matt"
          },
          "selected": true,
          "role": "root",
          "dependency_chain": [
            {
              "kind": "skill",
              "id": "ask-matt"
            }
          ]
        },
        {
          "resource": {
            "kind": "instruction",
            "id": "example-guidance"
          },
          "selected": false,
          "role": "unselected",
          "dependency_chain": []
        }
      ],
      "resources": [
        {
          "resource": {
            "kind": "skill",
            "id": "ask-matt"
          },
          "role": "root",
          "dependency_chain": [
            {
              "kind": "skill",
              "id": "ask-matt"
            }
          ],
          "readiness": {
            "configured": "true",
            "authorized": "unknown",
            "usable": "unknown"
          },
          "projection_summary": {
            "verified": 1,
            "missing": 0,
            "drifted": 0,
            "ambiguous": 0,
            "unmanaged": 0
          },
          "blockers": [],
          "conditions": []
        }
      ],
      "activation_role": "explicit",
      "lifecycle_state": "active",
      "conditions": [],
      "controlled_check": {
        "state": "unknown",
        "validity_identity": "controlled-check-fixture"
      },
      "historical_evidence": {
        "available": true,
        "message": ""
      }
    }
  ],
  "focused_resource": {
    "resource": {
      "kind": "skill",
      "id": "ask-matt"
    },
    "role": "root",
    "dependency_chain": [
      {
        "kind": "skill",
        "id": "ask-matt"
      }
    ],
    "readiness": {
      "configured": "true",
      "authorized": "unknown",
      "usable": "unknown"
    },
    "projection_summary": {
      "verified": 1,
      "missing": 0,
      "drifted": 0,
      "ambiguous": 0,
      "unmanaged": 0
    },
    "blockers": [],
    "conditions": []
  },
  "requirement": {
    "resource": {
      "kind": "skill",
      "id": "ask-matt"
    },
    "readiness": "usable",
    "satisfied": false
  }
}
